{
  "$schema": "../../schemas/pattern.schema.json",
  "schemaVersion": "1.0.0",
  "id": "pattern:application-shell",
  "kind": "pattern",
  "status": "stable",
  "summary": "Standard authenticated application architecture: one managed ShellApp receives router-owned navigation and page data plus product-owned tool data and persistent slotted content.",
  "useWhen": [
    "Building a standard authenticated application or workspace with CompoMo.",
    "Navigation, page chrome, global tools, and routed content must adapt across desktop, tablet, and mobile without parallel implementations.",
    "Tool owners and routed content must preserve element identity while their responsive presentation changes."
  ],
  "avoidWhen": [
    "Building authentication, onboarding, public, marketing, print, error, or intentionally focused full-screen experiences.",
    "The content is already rendered inside a ShellApp.",
    "A specialized product has a verified reason to own every chrome component through composition=\"slotted\"."
  ],
  "components": [
    {
      "component": "component:ds-shell-app",
      "role": "Standard managed owner of responsive application chrome, global-surface state, focus restoration, and stable application content slots.",
      "required": true
    },
    {
      "component": "component:ds-panel-nav",
      "role": "Managed desktop and tablet primary navigation; optionally presents route-section children inline or in a collapsed flyout.",
      "required": false
    },
    {
      "component": "component:ds-bar-nav",
      "role": "Default managed desktop and tablet route-section presentation; omitted when nested PanelNav owns sections.",
      "required": false
    },
    {
      "component": "component:ds-bar-page-title",
      "role": "Managed panel-mode shell-bar page chrome with all-or-nothing page-section tabs.",
      "required": false
    },
    {
      "component": "component:ds-shell-tools",
      "role": "Managed responsive adapter that presents persistent product-owned tool views through PanelTools or the mobile stage.",
      "required": false
    },
    {
      "component": "component:ds-shell-page",
      "role": "Managed routed-page boundary with desktop BarTitle and mobile MobileHeader presentations.",
      "required": false
    },
    {
      "component": "component:ds-mobile-sheet-nav",
      "role": "Managed mobile browser for Dashboard and Settings destinations.",
      "required": false
    },
    {
      "component": "component:ds-mobile-bar-nav",
      "role": "Managed persistent mobile destinations for Menu, current area, Search, Activity, Messages, Agents, and Help, with optional Inbox grouping.",
      "required": false
    },
    {
      "component": "component:ds-banner",
      "role": "Optional application-owned global message placed in the single shell banner lane.",
      "required": false
    }
  ],
  "stateOwnership": [
    "Lab or the consuming application supplies navigation, pageChrome, and tools objects to managed ShellApp.",
    "The application router owns authorization, current URLs, history, route changes, and the routed content placed in ShellApp's default slot.",
    "The application controls sectionNavigation and its user preference. bar is the default; panel moves canonical route sections under their PanelNav parent and emits dsNavChildSelect.",
    "ShellApp derives ShellPage desktop header placement from sectionNavigation so applications and routed pages never branch on navigation mode to repair content insets or sticky geometry.",
    "ShellApp emits stable navigation and page intent events; it never mutates router history.",
    "ShellApp owns responsive mode, PanelNav presentation, tool open state, active tool, direct mobile destinations, optional Inbox grouping, Menu state, fullscreen presentation, focus restoration, and breakpoint state preservation.",
    "Tool products and routed content are instantiated once by the application in named tool-view and default slots; ShellApp changes presentation without recreating those owners.",
    "The application owns rail accessory state, labels, timers, permissions, navigation, and action consequences. ShellApp forwards governed desktop and tablet accessory definitions and intents without changing tool selection or drawer state.",
    "When a transient status group and shortcut group coexist in the same rail region, the application assigns explicit orders for status, decorative boundary, then shortcuts; component behavior never infers grouping from product-specific ids.",
    "The application owns account menus, tool product data, page actions, and the consequences of every emitted intent event.",
    "The application owns viewport and theme-color metadata, the dynamic-viewport framework root, and containing document overscroll so body never becomes a second application scroller; ShellApp fills that owner and keeps its existing internal scrollers.",
    "The application resolves competing global messages to one Banner and owns its actions, controlled open state, orientation for the available shell capacity, dismissal persistence, and removal after exit motion.",
    "Use composition=\"slotted\" only when a team intentionally needs to assemble the public lower-level chrome components itself.",
    "Keep external surface ownership separate from selected routes, toggled modes, and inline expansion. Forward surfaceOpen on header actions while their associated menu or panel remains rendered, including exit motion; clear it after closing. Internal popup controls manage this relationship themselves."
  ],
  "accessibility": [
    "Render exactly one managed ShellApp and one active routed main landmark.",
    "Provide visible labels and accessible names in navigation, pageChrome, and tool definitions before passing them to ShellApp.",
    "Handle ShellApp intent events without replacing focusable owners during responsive or fullscreen transitions.",
    "Pair accessory status indicators with accessible status text and keep decorative accessory boundaries out of the accessibility tree.",
    "Keep the canonical Agents and Help tools available; expose Activity directly on mobile unless the product explicitly opts into grouped Inbox behavior.",
    "Do not override browser keyboard chords when enabling shell shortcuts."
  ],
  "responsiveBehavior": [
    "ShellApp automatically resolves desktop at 1200px and wider, tablet from 768px through 1199px, and mobile below 768px.",
    "Desktop and tablet use PanelNav, PanelTools through ShellTools, and ShellPage chrome. sectionNavigation chooses either BarNav or nested PanelNav plus BarPageTitle in the shell bar.",
    "Panel section navigation removes page-local desktop title geometry: standard inset pages begin 16px below the shell bar on desktop and tablet, while full-bleed pages remain full bleed.",
    "Mobile uses MobileSheetNav, MobileBarNav, MobileHeader, ShellTools mobile presentation, and the same routed content owner. MobileBarNav paints its primary surface through the bottom safe-area inset so light browser chrome and application chrome meet without a secondary-surface seam.",
    "Below 768px the application root owns a 100dvh fixed stage with a 100vh fallback while ShellApp continues to fill its owner with height 100%; JavaScript viewport measurement synchronizes only the chrome wash and does not own layout height.",
    "With viewport-fit=cover, ShellApp consumes the shared top safe-area inset once and MobileBarNav consumes the persistent bottom inset; nested routed, tool, sheet, and consumer headers do not duplicate either inset.",
    "An optional Banner spans the complete application above desktop navigation, workspace, tools, and mobile global surfaces while remaining below the operating-system top safe area.",
    "Desktop and tablet may render governed direct-action rail accessories. Mobile intentionally omits them, so applications provide equivalent persistent status in the top Banner lane when the product requires it.",
    "Switching breakpoints changes presentation and inert state without recreating route or tool elements.",
    "Switching sectionNavigation changes where route sections live: panel expands them inside MobileSheetNav on mobile and combines the page title with any active local subsection in one sheet trigger. Detail pages use this combined trigger in both modes. The current route, routed content, and tool state remain stable.",
    "Search, Activity, Messages, and Agents use direct mobile destinations; products may explicitly group review tools under Inbox instead."
  ],
  "implementations": {
    "customElements": {
      "status": "verified",
      "recipes": [
        {
          "id": "managed-shell",
          "title": "Managed application shell",
          "summary": "Supply typed data and persistent application-owned content to one ShellApp.",
          "files": [
            {
              "path": "app-shell.html",
              "language": "html",
              "content": "<ds-shell-app id=\"shell\">\n  <app-agents slot=\"agents-view\"></app-agents>\n  <app-messages slot=\"messages-view\"></app-messages>\n  <app-activity slot=\"activity-view\"></app-activity>\n  <app-search slot=\"search-view\"></app-search>\n  <app-help slot=\"help-view\"></app-help>\n  <app-route-content><!-- router-owned page --></app-route-content>\n</ds-shell-app>"
            },
            {
              "path": "app-shell.ts",
              "language": "typescript",